<?xml version="1.0" encoding="UTF-8"?>

<conteudos xmlns:xsi="http://www.w3.org/2001/XMLSchema-instance"
            xsi:noNamespaceSchemaLocation="conteudos.xsd">
        
    <pagina url="${doc.paginas}/funcs-nativas.html">            
        <chave nome="abs" peso="10" />
        <chave nome="acos" peso="10" />
        <conteudo id="asen">
            <chave nome="asen" peso="10" />
            <chave nome="asin" peso="10" />
        </conteudo> 
        <chave nome="arredonda" peso="10" />
        <chave nome="atan" peso="10" />
        <chave nome="atan2" peso="10" />
        <chave nome="caractere" peso="10" />
        <chave nome="cos" peso="10" />        
        <chave nome="div" peso="10" />           
        <chave nome="exp" peso="10" />   
        <chave nome="fexec" peso="10" />       
        <chave nome="fracionario" peso="10" /> 
        <chave nome="getcharset" peso="10" />      
        <chave nome="graus" peso="10" />       
        <chave nome="inteiro" peso="10" />       
        <chave nome="log" peso="10" />       
        <chave nome="log10" peso="10" />       
        <chave nome="logN" peso="10" />       
        <chave nome="maiusculas" peso="10" />       
        <chave nome="minusculas" peso="10" />       
        <chave nome="matmult" peso="10" />       
        <chave nome="mod" peso="10" />               
        <chave nome="mult" peso="10" />              
        <conteudo id="parastr">
            <chave nome="parastr" peso="10" />
            <chave nome="valueof" peso="10" />
            <chave nome="parsestring" peso="10" />
            <chave nome="parsestr" peso="10" />
            <chave nome="converte" peso="2" />
            <chave nome="converter" peso="2" />
        </conteudo> 
        <chave nome="plot" peso="10" />              
        <conteudo id="plot3d">
            <chave nome="plot3d" peso="10" />
            <chave nome="surf" peso="10" />
            <chave nome="mesh" peso="10" />            
            <chave nome="plot3" peso="10" />
        </conteudo> 
        <conteudo id="pot">
            <chave nome="pot" peso="10" />
            <chave nome="pow" peso="10" />
        </conteudo>                     
        <chave nome="radianos" peso="10" />              
        <chave nome="random" peso="10" />              
        <conteudo id="rquad">
            <chave nome="rquad" peso="10" />
            <chave nome="sqrt" peso="10" />
        </conteudo> 
        <conteudo id="sen">
            <chave nome="sen" peso="10" />
            <chave nome="sin" peso="10" />
        </conteudo>              
        <chave nome="setcharset" peso="10" />      
        <chave nome="soma" peso="10" />
        <conteudo id="strtam">
            <chave nome="strtam" peso="10" />           
            <chave nome="strlen" peso="10" />           
            <chave nome="length" peso="10" />           
        </conteudo>                               
        <conteudo id="strparareal">
            <chave nome="strparareal" peso="10" />           
            <chave nome="parseint" peso="10" />           
            <chave nome="parsedouble" peso="10" />           
            <chave nome="parsefloat" peso="10" />           
            <chave nome="converter" peso="4" />             
            <chave nome="converte" peso="4" />                       
        </conteudo>  
        <conteudo id="strparabool">
            <chave nome="strparabool" peso="10" />           
            <chave nome="parsebool" peso="10" />           
            <chave nome="parseboolean" peso="10" />          
            <chave nome="converter" peso="3" />             
            <chave nome="converte" peso="3" />               
        </conteudo> 
        
        <chave nome="sub" peso="10" />                   
        <chave nome="substring" peso="10" />           
        <chave nome="tan" peso="10" />           
        <conteudo id="tipode">
            <chave nome="tipode" peso="10" />
            <chave nome="sizeof" peso="10" />
        </conteudo>           
        <chave nome="transposta" peso="10" />           
        <conteudo id="vetesp">           
            <chave nome="vetesp" peso="10" />
            <chave nome="linspace" peso="10" />
        </conteudo>
        <conteudo id="xmalhagrade">           
            <chave nome="xmalhagrade" peso="10" />
            <chave nome="meshgrid" peso="10" />
        </conteudo>
        <conteudo id="ymalhagrade">           
            <chave nome="ymalhagrade" peso="10" />
            <chave nome="meshgrid" peso="10" />
        </conteudo>
    </pagina>
        
</conteudos>
