<?xml version="1.0" encoding="UTF-8"?>

<conteudos xmlns:xsi="http://www.w3.org/2001/XMLSchema-instance"
            xsi:noNamespaceSchemaLocation="conteudos.xsd">
        
    <pagina url="${doc.paginas}/comandos.html">       
        <chave nome="script" peso="10" />      
        <conteudo id="use">
            <chave nome="use" peso="10" />      
            <chave nome="importe" peso="10" />
            <chave nome="import" peso="10" />
            <chave nome="include" peso="10" />
        </conteudo>
        <chave nome="cd" peso="10" />      
        <conteudo id="ls">
            <chave nome="ls" peso="10" />      
            <chave nome="dir" peso="10" />
        </conteudo>     
        <chave nome="liste" peso="10" />      
        <chave nome="ajuda" peso="10" /> 
        <conteudo id="sair">
            <chave nome="sair" peso="10" />      
            <chave nome="exit" peso="10" />
            <chave nome="quit" peso="10" />
        </conteudo>  
        <conteudo id="exiba">
            <chave nome="exiba" peso="10" />      
            <chave nome="print" peso="10" />
            <chave nome="printf" peso="10" />      
            <chave nome="cout" peso="10" />
            <chave nome="write" peso="10" />
        </conteudo>   
        <conteudo id="exibaln">
            <chave nome="exibaln" peso="10" />      
            <chave nome="print" peso="8" />
            <chave nome="printf" peso="8" />      
            <chave nome="cout" peso="8" />
            <chave nome="writeln" peso="10" />
        </conteudo> 
        <conteudo id="leialn">
            <chave nome="leialn" peso="10" />      
            <chave nome="read" peso="10" />
            <chave nome="scanf" peso="10" />      
            <chave nome="readln" peso="10" />
            <chave nome="cin" peso="10" />
        </conteudo>      
        <chave nome="continue" peso="10" />
        <conteudo id="pare">
            <chave nome="pare" peso="10" />      
            <chave nome="break" peso="10" />
        </conteudo> 
    </pagina>
    
</conteudos>
