<?xml version="1.0" encoding="UTF-8"?>

<conteudos xmlns:xsi="http://www.w3.org/2001/XMLSchema-instance"
            xsi:noNamespaceSchemaLocation="conteudos.xsd">
        
    <pagina url="${doc.paginas}/vetores-e-matrizes.html">   
        <conteudo id="arrays">
            <chave nome="arrays" peso="20" />
            <chave nome="vetores" peso="10" />            
            <chave nome="vetor" peso="10" />            
            <chave nome="lista" peso="10" />            
            <chave nome="listas" peso="10" />            
            <chave nome="unidimensional" peso="10" />
        </conteudo>
        <conteudo id="matrizes">
            <chave nome="bidimensional" peso="20" />
            <chave nome="matrizes" peso="10" />                        
            <chave nome="matriz" peso="10" />
            <chave nome="arrays" peso="7" />
            <chave nome="vetores" peso="9" />            
            <chave nome="lista" peso="3" />            
            <chave nome="listas" peso="3" />            
        </conteudo>
        <conteudo id="submatrizes">
            <chave nome="submatrizes" peso="20" />                        
            <chave nome="matrizes" peso="10" />                        
            <chave nome="matriz" peso="10" />
            <chave nome="arrays" peso="7" />
            <chave nome="vetores" peso="9" />            
            <chave nome="lista" peso="3" />            
            <chave nome="listas" peso="3" />            
            <chave nome="bidimensional" peso="4" />
            <chave nome="unidimensional" peso="4" />
        </conteudo>
    </pagina>

</conteudos>