<?xml version="1.0" encoding="UTF-8"?>

<conteudos xmlns:xsi="http://www.w3.org/2001/XMLSchema-instance"
            xsi:noNamespaceSchemaLocation="conteudos.xsd">
        
    <pagina url="${doc.paginas}/vars-nativas.html">            
        <chave nome="pi" peso="10" />
        <chave nome="e" peso="10" />
        <chave nome="inf" peso="10" />
        <chave nome="nan" peso="10" />
        <conteudo id="div-por-zero">
            <chave nome="div_por_zero" peso="10" />
            <chave nome="div-por-zero" peso="10" />
        </conteudo>
        <chave nome="usuariodir" peso="10" />
        <chave nome="scriptdir" peso="10" />        
    </pagina>
    
</conteudos>
