<?xml version="1.0" encoding="UTF-8"?>

<conteudos xmlns:xsi="http://www.w3.org/2001/XMLSchema-instance"
            xsi:noNamespaceSchemaLocation="conteudos.xsd">
        
    <pagina url="${doc.paginas}/orientacao-a-objetos.html">
        <conteudo>
            <chave nome="orientação" peso="13" />
            <chave nome="objetos" peso="15" />
            <chave nome="objeto" peso="15" />
            <chave nome="instancia" peso="15" />
            <chave nome="polimorfismo" peso="15" />
            <chave nome="composição" peso="15" />
            <chave nome="classe" peso="15" />
            <chave nome="classes" peso="15" />
            <chave nome="atributos" peso="12" />            
            <chave nome="construtores" peso="12" />
            <chave nome="construtor" peso="12" />
            <chave nome="funções" peso="12" />
            <chave nome="func" peso="12" />                                    
            <chave nome="subclasses" peso="12" />                
            <chave nome="novo" peso="12" />
            <chave nome="new" peso="12" />        
        </conteudo>
        
        <conteudo id="construtores">
            <chave nome="construtores" peso="15" />
            <chave nome="construtor" peso="15" />    
        </conteudo>
        
        <conteudo id="este">
            <chave nome="este" peso="15" />
            <chave nome="this" peso="15" />
            <chave nome="base" peso="15" />
            <chave nome="func" peso="5" />
            <chave nome="construtor" peso="5" />
            <chave nome="atributo" peso="5" />
            <chave nome="classe" peso="8" />          
        </conteudo>
		
        <conteudo id="super">
            <chave nome="super" peso="15" />
            <chave nome="base" peso="15" />
            <chave nome="func" peso="5" />
            <chave nome="construtor" peso="5" />
            <chave nome="atributo" peso="5" />
            <chave nome="classe" peso="8" />          
        </conteudo>
		
		<conteudo id="extende">
            <chave nome="extende" peso="15" />
            <chave nome="super" peso="10" />
            <chave nome="this" peso="5" />
            <chave nome="construtor" peso="5" />
            <chave nome="atributo" peso="5" />
            <chave nome="classe" peso="10" />          
        </conteudo>		
        
        <conteudo id="subclasses">
            <chave nome="subclasses" peso="15" />
            <chave nome="subclasse" peso="15" />
            <chave nome="classe" peso="12" />      
        </conteudo>
        
        <conteudo id="pacotes">
            <chave nome="pacotes" peso="15" />
            <chave nome="pacote" peso="15" />
            <chave nome="classe" peso="12" />      
        </conteudo>
        
        <conteudo id="classes-nomes-iguais">
            <chave nome="instancia" peso="8" />
            <chave nome="novo" peso="8" />
            <chave nome="new" peso="8" />
            <chave nome="pacotes" peso="10" />
            <chave nome="pacote" peso="10" />
            <chave nome="classe" peso="8" />      
        </conteudo>
        
        <conteudo id="extende">
            <chave nome="extende" peso="15" />
            <chave nome="herança" peso="15" />
            <chave nome="new" peso="8" />
            <chave nome="pacotes" peso="10" />
            <chave nome="pacote" peso="10" />
            <chave nome="classe" peso="8" />      
        </conteudo>
    </pagina>
</conteudos>
