<?xml version="1.0" encoding="UTF-8"?>

<conteudos xmlns:xsi="http://www.w3.org/2001/XMLSchema-instance"
            xsi:noNamespaceSchemaLocation="conteudos.xsd">
        
    <pagina url="${doc.paginas}/estruturas-de-decisao.html">
        <conteudo>
            <chave nome="estrutura" peso="8" />
            <chave nome="decisão" peso="10" />
            <chave nome="condição" peso="10" />
            <chave nome="fluxo" peso="8" />
            <chave nome="execução" peso="8" />
            <chave nome="bloco" peso="5" />
            <chave nome="codigo" peso="5" />
        </conteudo>
        <conteudo id="se">
            <chave nome="se" peso="10" />
            <chave nome="entao" peso="10" />
            <chave nome="senao" peso="10" />
            <chave nome="if" peso="10" />
            <chave nome="then" peso="10" />
            <chave nome="else" peso="10" />
        </conteudo>
        <conteudo id="compare/caso">
            <chave nome="compare" peso="10" />
            <chave nome="caso" peso="10" />
            <chave nome="padrao" peso="10" />
            <chave nome="pare" peso="8" />            
            <chave nome="switch" peso="15" />
            <chave nome="case" peso="10" />
            <chave nome="default" peso="10" /> 
            <chave nome="break" peso="8" />          
        </conteudo>
    </pagina>
    
</conteudos>
