<?xml version="1.0" encoding="UTF-8"?>

<conteudos xmlns:xsi="http://www.w3.org/2001/XMLSchema-instance"
            xsi:noNamespaceSchemaLocation="conteudos.xsd">
    
    <propriedade nome="conf.basedir">conf</propriedade>
    <propriedade nome="conf.ajuda">${conf.basedir}/ajuda</propriedade>
    <propriedade nome="conf.ajuda.classes">${conf.ajuda}/classes</propriedade>

    <propriedade nome="doc.url">https://www.italoinfo.com.br/projetos/explab/doc</propriedade>
    <propriedade nome="doc.paginas">paginas</propriedade>      
    <propriedade nome="doc.paginas.classes">${doc.paginas}/classes</propriedade>

    <arquivo>${conf.ajuda}/comandos.xml</arquivo>    
    <arquivo>${conf.ajuda}/funcs-nativas.xml</arquivo>
    <arquivo>${conf.ajuda}/vars-nativas.xml</arquivo>
    <arquivo>${conf.ajuda}/tipos-de-dados.xml</arquivo>
    <arquivo>${conf.ajuda}/expressoes.xml</arquivo>
    <arquivo>${conf.ajuda}/incrementos-e-decrementos.xml</arquivo>
    <arquivo>${conf.ajuda}/estruturas-de-decisao.xml</arquivo>
    <arquivo>${conf.ajuda}/estruturas-de-repeticao.xml</arquivo>
    <arquivo>${conf.ajuda}/vetores-e-matrizes.xml</arquivo>
    <arquivo>${conf.ajuda}/funcoes.xml</arquivo>
    <arquivo>${conf.ajuda}/orientacao-a-objetos.xml</arquivo>
    <arquivo>${conf.ajuda}/graficos-e-plotagem.xml</arquivo>
    <arquivo>${conf.ajuda.classes}/classes-nativas.xml</arquivo>
    
</conteudos>
