<?xml version="1.0" encoding="UTF-8"?>

<conteudos xmlns:xsi="http://www.w3.org/2001/XMLSchema-instance"
            xsi:noNamespaceSchemaLocation="conteudos.xsd">
        
    <pagina url="${doc.paginas}/funcoes.html">            
        <conteudo>
            <chave nome="func" peso="15" />
            <chave nome="function" peso="15" />                        
            <chave nome="função" peso="15" />            
            <chave nome="funções" peso="15" />
            <chave nome="parametros" peso="8" />
            <chave nome="retorne" peso="12" />
            <chave nome="return" peso="12" />
            <chave nome="recursividade" peso="10" />
            <chave nome="variáveis" peso="5" />
            <chave nome="subprogramas" peso="10" />
            <chave nome="bloco" peso="5" />
            <chave nome="codigo" peso="5" />
        </conteudo>
        
        <conteudo id="recursividade" >
            <chave nome="recursividade" peso="15" />
            <chave nome="recursiva" peso="15" />            
            <chave nome="recursivo" peso="15" />
            <chave nome="func" peso="10" />
            <chave nome="function" peso="10" />                        
            <chave nome="função" peso="10" />            
            <chave nome="funções" peso="10" />
            <chave nome="retorne" peso="8" />
            <chave nome="retorne" peso="8" />            
            <chave nome="parametros" peso="8" />
            <chave nome="subprogramas" peso="10" />
        </conteudo>
               
        <conteudo id="func-var" >
            <chave nome="var" peso="12" />
            <chave nome="variavel" peso="12" />
            <chave nome="func" peso="12" />
            <chave nome="function" peso="12" />                        
            <chave nome="função" peso="12" />            
            <chave nome="funções" peso="12" />
            <chave nome="retorne" peso="8" />
            <chave nome="retorne" peso="8" />            
            <chave nome="parametros" peso="8" />
            <chave nome="subprogramas" peso="10" />
        </conteudo>
    </pagina>
        
</conteudos>
